<?xml version="1.0" encoding="UTF-8" ?>
<report
        xmlns="http://wtms.com/xml/statistical-1.0.xsd"
        xmlns:xsi="http://www.w3.org/2001/XMLSchema-instance"
        xsi:schemaLocation="http://wtms.com/xml/statistical-1.0.xsd"
        code="cashoutDetailReport" type="pagedListGrid" name="提现明细报表"
>

    <!-- 页面附加的javascript:非必填 -->
    <script></script>

    <!-- cols：非必填： 默认为2 如果条件项小于3，则自动修改对应值，如果为3的倍数，则为3，如果为2的倍数则为2 -->
    <conditions cols="3">
        <item id="name" name="店铺名称" value="" type="input"/>
        <item id="price" name="价格" value="" type="input"/>


    </conditions>

    <!-- fitColumns:非必填，默认值为false -->
    <views fitColumns="false" sqlMapperId="queryTradingSummaryReport">
        <!-- formatter: -->
        <!-- width:非必填：默认值为 150 -->
        <!-- hidden:非必填：false -->
        <!-- frozen:非必填：false -->
        <item column="name" name="店铺名称" data="name"/>
        <item column="price" name="价格" data="price"/>
        <item column="amount" name="金额" type="number" data="amount"/>
        <item column="phone" name="电话" type="number" data="phone" />
        <item column="quantity" name="数量" statisticalType="sum" data="quantity"/>

    </views>

    <sqlMappers>
        <!-- datebaseId:非必填: 如果不填则databaseId为默认值 -->
        <sqlMapper id="queryTradingSummaryReport" datasourceId="">
            SELECT
            o.amount,
            o.createdDate,
            b.`name`,
            o.price,
            o.phone,
            o.quantity
            FROM
            orders o
            LEFT JOIN business b ON o.business_id = b.id
        </sqlMapper>
    </sqlMappers>


</report>


